{
  "effort_cost": 1,
  "evidence_requests": [
    "identity contract",
    "key analysis"
  ],
  "id": "engineering-question.reconcile.identity",
  "obligation_id": "obligation.reconcile",
  "priority": 10,
  "prompt": "What defines record, entity, transaction, or version identity?",
  "required_permissions": [],
  "response_modes": [
    "deterministic",
    "human"
  ],
  "suggested_checks": [
    "duplicate fixtures",
    "split-entity fixtures"
  ],
  "universal_engineering_model_version": "0.1",
  "why_it_matters": "Wrong grain makes deduplication and balancing irrecoverably ambiguous."
}
